Transliterated_Comment,sarcasm_label
sala nallla isko bhejo yar koi jel,non-sarcastic
Bike Wale ki gaand marni chahiye thi face_with_tears_of_joy face_with_tears_of_joy,sarcastic
Is saali ko ek vote nhi milna chahiye hinduon ka hindu bhaiyon ek ho jao plz fire fire fire fire fire fire dikha do isko iski aukat fire fire fire fire fire fire fire,sarcastic
I think his leg will gone skull,non-sarcastic
result ka wait kro ..........? grinning_face,non-sarcastic
"Did every garib and sc,st is only Muslim?",non-sarcastic
face_with_tears_of_joy face_with_tears_of_joy face_with_tears_of_joy face_with_tears_of_joy face_with_tears_of_joy face_with_tears_of_joy face_with_tears_of_joy,non-sarcastic
Uttarakhand mai bhi Congress saff face_with_tears_of_joy,sarcastic
"ye condom tere bap ko pehnna chahiye tha , tere jaisa chutiya andhbhkt paida nhi hota , tum jaise chutiyo ki wajah khatam hone ki kagar. p agya h",non-sarcastic
Waah re pappua ii sala kabo pm banega face_with_tears_of_joy face_with_tears_of_joy,sarcastic
face_with_tears_of_joy face_with_tears_of_joy face_with_tears_of_joy face_with_tears_of_joy face_with_tears_of_joy rolling_on_the_floor_laughing rolling_on_the_floor_laughing rolling_on_the_floor_laughing rolling_on_the_floor_laughing,non-sarcastic
to thoda bhn ka luda hai,sarcastic
ha bhai jis aurangya ne unke 2bacho ko zinda gad diya aur hamare dharmveer chatrapati sambhaji maharaj ko tadpa tadpa ke mara aj ka din mas balidan din hamare chatrapati sambhaji maharaj ka crying_face crying_face,non-sarcastic
to muslim bhi kitne ache hai face_with_tears_of_joy face_with_tears_of_joy,sarcastic
gobar bhakt haina.to dangai bt kregi hi,sarcastic
fire fire fire fire fire fire fire fire,non-sarcastic
Le Rathee ki education pr moot diya face_with_tears_of_joy check_mark_button,sarcastic
folded_hands triangular_flag Jai shree ram triangular_flag folded_hands,non-sarcastic
mujhe garva hai ki main hindoo hoon triangular_flag triangular_flag triangular_flag triangular_flag triangular_flag,non-sarcastic
chinaala aahe saalee 15 kela khaayachee,sarcastic
Kuch jiyada pareshan ho gye face_with_tears_of_joy face_with_tears_of_joy face_with_tears_of_joy face_with_tears_of_joy,non-sarcastic
Behan chod face_with_tears_of_joy face_with_tears_of_joy face_with_tears_of_joy face_with_tears_of_joy,sarcastic
Tum log ke saath aisa hi hona chahiye rolling_on_the_floor_laughing rolling_on_the_floor_laughing face_with_tears_of_joy face_with_tears_of_joy enraged_face,non-sarcastic
samor ali na nahi tuza kaftyat dili na ky rahile,non-sarcastic
"satta me ho abhi jish din satta jayegi, koi bjp ka leadr aisa nahi bachega jo jail me na ho, abhi dudh k dhule bn rahe ho 10 sal me desh ko deemak ki traha kha gye bjp wale",non-sarcastic
Raat ko denge khatakhat fatafat rolling_on_the_floor_laughing,non-sarcastic
n bss yhi puchunga kyu aur kuch nhi,non-sarcastic
koi sar fira ek hi time 10 se 15 hijdo ko thoke sanaata cha jayega smiling_face_with_heart-eyes smiling_face_with_heart-eyes smiling_face_with_heart-eyes ek hi time pe,sarcastic
please do something.... To neutralize it,non-sarcastic
bhai dhurv ko chhod deshbhakt kaha hai bjp wale kaha hai wo to esi tesi kr sakte hai ya sirf masjid mandir ke muddo pr ladna ata hai hijdo se kaha hai wo hindu jo apne ap ko deshbhakt batate hai bate itni badi badi ki hum eesrael me jakr support krnege unme na koi tumhara bhai na koi dharam ka is mudde pr jao na waha tirnge ke sath khilwad krne wale ki esi tesi kr denge maze dari tb hai,sarcastic
Congress ka Kiya hua h enraged_face enraged_face,sarcastic
aaese chitiyo ne bikers ka name kharab kar rakha hai,non-sarcastic
aaaj tak ka news bhi gaya hai vah bhajpa news ho gaya,non-sarcastic
sach me mene nahi ke re rete maa awor bhain me sat gadare usne jitna bola uta kara me usko face_with_tears_of_joy fire raising_hands,non-sarcastic
rolling_on_the_floor_laughing rolling_on_the_floor_laughing chutiya banaya tumko rolling_on_the_floor_laughing rolling_on_the_floor_laughing,non-sarcastic
aaccha ha ki ma hindu hu triangular_flag triangular_flag,sarcastic
Congres htao bjp lao check_mark_button check_mark_button,sarcastic
sali m rhptt de 2. 4 .,sarcastic
"vinit samose jaude , ashi loka yetat jagevr . ekda akkal thikani lagli ki kalta tyana .",sarcastic
are hee baaraa baapaachee paidaasa aahe cheenaala radee aahe hee aayaghaalee,non-sarcastic
"If that happens, there will be a world war and you have to start counting from number 1.",non-sarcastic
Har mahine 8500 rup ki lalach me face_with_tears_of_joy face_with_tears_of_joy face_with_tears_of_joy,sarcastic
ab kyu nahi bol raha bhai enraged_face,sarcastic
to bc congress ki sarkar bani kaha,sarcastic
ya subcontinent k mully demag khatab kr rahy mera ksi din mainy aik 2 thok dyny hain,sarcastic
ye pacha mein janta bikh gayi crying_face,non-sarcastic
nuslim contestant win kargaya eesle godi kutte ke jalre hey.,sarcastic
Ekta kapoor ki gaand fat gyi ye video dekh k face_with_tears_of_joy,non-sarcastic
sarkar kaha bani modi hi tho bana,sarcastic
Sab zhol hai... face_with_tears_of_joy face_with_tears_of_joy face_with_tears_of_joy face_with_tears_of_joy,non-sarcastic
thinking_face achcha to iska naam bahan chod hai face_with_tears_of_joy clapping_hands,non-sarcastic
Abe chutiya yaha baat ho Rahi ki sitting chief minister ko pahli baar jail hui h.......ye bjp wale sach me andhbhakt h face_with_tears_of_joy face_with_tears_of_joy face_with_tears_of_joy face_with_tears_of_joy,sarcastic
rolling_on_the_floor_laughing rolling_on_the_floor_laughing rolling_on_the_floor_laughing rolling_on_the_floor_laughing rolling_on_the_floor_laughing rolling_on_the_floor_laughing aur de lo en logo ko vote face_with_tears_of_joy face_with_tears_of_joy face_with_tears_of_joy face_with_tears_of_joy face_with_tears_of_joy face_with_tears_of_joy face_with_tears_of_joy,sarcastic
paise ke lalach nein desh ko bhi congress nam kar dega yah log,non-sarcastic
dar ki ma ki chut... check_mark_button,non-sarcastic
bola to nodi ji ne bhi bahut kucch tha nila kya,non-sarcastic
She is Faster than flash bruhhhh exploding_head,non-sarcastic
moai dar ki ma ki cude skull,non-sarcastic
Bro like 72 hooooor rolling_on_the_floor_laughing rolling_on_the_floor_laughing rolling_on_the_floor_laughing rolling_on_the_floor_laughing rolling_on_the_floor_laughing,non-sarcastic
tumhari man ka bhosda godi media,sarcastic
Tujhse achi acting to eet ne ki hai check_mark_button,sarcastic
30 February ko ayenge khatakhat paise rolling_on_the_floor_laughing,non-sarcastic
Fir agar humna.purni.baat nikli toh kya hoga smiling_face_with_horns angry_face_with_horns,non-sarcastic
nodi kon sa kam kiya hain face_with_tears_of_joy yehe sabh,non-sarcastic
bhai jab chhodage hamesha to kya hi hoga aur sapna dekhna na band kar do kyuki akele hi kafi hai tumhari ma chhodne ke liye ham ko unlimited log nhi chahiye fire,non-sarcastic
Aaj ki #Dihadi jada mili hai ise face_with_tears_of_joy face_with_tears_of_joy face_with_tears_of_joy face_with_tears_of_joy,non-sarcastic
Chamche nahi dikhre clown_face clown_face clown_face clown_face clown_face,non-sarcastic
jo apni bahan ke sath kar sakta hai wo bahanchod hota hai,sarcastic
"Eat five star fear can not do anything, mountain dew dar ke aage Jeet hai face_with_tears_of_joy",sarcastic
maaya baapa -aamachee poragee punyaalaa shikaayalaa haaya le poragee slightly_smiling_face moai fire,non-sarcastic
ye aandhalee thobaada bagha tujhan tujhee laayakee pana naahee,non-sarcastic
Lwda mily ga congress ka inhe,sarcastic
Kaha gaya dhruv rathee give the fact to waqt act,sarcastic
"Tor mayer gud Mari khankir chele, rndichoda , condom chor..... Also respect India",sarcastic
kytte tere se bada atankwadi desj k liye koi nhi h khud jail me rh ke aya h,non-sarcastic
Rathi ke Amma bhen ka bhosada itna bada hai kr usme ek madarsa aaram se khul jaye face_with_tears_of_joy fire check_mark_button check_mark_button check_mark_button face_with_tears_of_joy rolling_on_the_floor_laughing rolling_on_the_floor_laughing bolo aameen face_with_tears_of_joy check_mark_button fire rolling_on_the_floor_laughing rolling_on_the_floor_laughing rolling_on_the_floor_laughing,sarcastic
Meanwhile Yamraj :: cheating cheating karta hai tou face_with_tears_of_joy,sarcastic
na ki ch#t thari jai bharat eendia always,sarcastic
abe ye btao sarkar bni kiski h eendeeaa ki ya ndaa ki??,sarcastic
jo bharose wale hote hai wahi bhosdi wale hote hai cross_mark cross_mark,non-sarcastic
garibon ko batao sarkar paise dene wale ki nahin paise lootane wale ki bani hai,sarcastic
baat to sahi h... check_mark_button face_with_tears_of_joy,non-sarcastic
oop wale gaddar h gaddar fill kiya kayega,non-sarcastic
o bhai had kar di en chotiyo ne ye news hai,sarcastic
"kuta ese kartehan, lage rehe suar",sarcastic
Or ye bhi batata rahio apne aulado ko ki hum sb milke bhi kuch ukhad nhi paee face_with_tears_of_joy face_with_tears_of_joy,sarcastic
face_with_tears_of_joy face_with_tears_of_joy pol khol diya face_with_tears_of_joy face_with_tears_of_joy,non-sarcastic
Comment box me muslim kyu nahi dikh rehe hai face_with_tears_of_joy face_with_tears_of_joy face_with_tears_of_joy,sarcastic
tum bhi sayad ek tihari ho to kya tera beta bhi tihari hoga?,non-sarcastic
kisi ke sagi nahi hain ye paltu aur na shukra kaum hai ye,sarcastic
star + nountain dew dar ki ma ki double chut,non-sarcastic
hindustaana ke sabase achchaa sanaatanee ayodhyaa kaa hai| triangular_flag triangular_flag triangular_flag,non-sarcastic
Zameen me dafan hua. Tata by by khatam face_with_tears_of_joy face_with_tears_of_joy face_with_tears_of_joy face_with_tears_of_joy,sarcastic
desh me nafrat failana deshdrohee nhi hota kya???,non-sarcastic
enraged_face enraged_face enraged_face enraged_face enraged_face enraged_face enraged_face enraged_face,non-sarcastic
Uddhav thakre aho khrch maza aaj peryant vishwas basat nhi tumhi kharch balasahebanchi aulad aahat ka face_with_monocle,sarcastic
Reel me kabse serial chlne laga hot_face,non-sarcastic
face_with_tears_of_joy face_with_tears_of_joy face_with_tears_of_joy face_with_tears_of_joy face_with_tears_of_joy face_with_tears_of_joy face_with_tears_of_joy face_with_tears_of_joy,non-sarcastic
muglo ka baap kon chatarpati shivaji face_with_tears_of_joy face_with_tears_of_joy face_with_tears_of_joy,sarcastic
5 star doing nothing----mountain dew daar ki ma ki chut-----this uncle___-------the cameraman deaf_person_medium_skin_tone shushing_face,sarcastic
