Transliterated_Comment,sarcasm_label
nodi je triangular_flag triangular_flag triangular_flag bjp,non-sarcastic
tu ja ai cha dana ...,sarcastic
Maine pura comment dekh liya lekin kisi muslim ka comment nhi mila rolling_on_the_floor_laughing rolling_on_the_floor_laughing rolling_on_the_floor_laughing,non-sarcastic
Ek papu ne UP walo ko bhi papu bnaa diyaaa face_with_tears_of_joy face_with_tears_of_joy,sarcastic
vote ki jaga agr ishe koi tod de to jyada achha h,sarcastic
Chunav se phle Grav hota tha UP PR Aaj Afsos hota h Ayodhya UP m kyo h crying_face crying_face crying_face,non-sarcastic
Bhai govt Baan ne dengey na rolling_on_the_floor_laughing Opposition hoke Kesse dengey face_with_tears_of_joy,sarcastic
nuj to uski id pe kuch nhi dikha kb legaya tha,non-sarcastic
Cameraman never dies fire fire fire,non-sarcastic
Pata chal gya muslimo ka asliyat enraged_face cross_mark jay shree ram ji check_mark_button triangular_flag,sarcastic
Abhi system bne do bhai check_mark_button,non-sarcastic
baajaaroo hai aura kara bhee kyaa sakatee hai aukaata kandoma vaalee hee to hai isakee eenc,non-sarcastic
Bs itna confidence chahea life me,non-sarcastic
face_with_tears_of_joy face_with_tears_of_joy face_with_tears_of_joy face_with_tears_of_joy face_with_tears_of_joy face_with_tears_of_joy face_with_tears_of_joy face_with_tears_of_joy,non-sarcastic
haa haa haa haa haa haa haa haa haa haa haa,non-sarcastic
"ᴛᴇʀᴇ ko ᴋᴜᴄʜ ʙᴏʟᴀ ᴛʜᴀ ᴋʏᴀ ᴍᴀᴅᴀʀᴄʜᴏᴅ? ɢᴀᴀʟɪ ᴋʜᴀᴀɴᴇ ᴋᴀ ᴋᴀᴀᴍ ᴋʏᴜ ᴋʀᴛᴀ ʜᴀ? ʙʜᴀᴀʟᴀᴀ ᴛᴏ ᴍᴇᴇ ᴛᴇᴇʀʀɪ ɢᴀᴀɴᴅᴅ ᴍᴇᴇ ɢʜᴜsᴀᴅ ᴅᴜɴɢᴀ ᴛᴜ 72 ʜᴜʀᴏ ᴍᴇ sᴇ ᴇᴋ ʜᴀ, ʙᴜʀᴋʜᴀ ᴘʜᴇɴ ᴋ ʙʜᴏɴᴋ ᴀᴘɴɪ ᴀsʟɪ ᴘᴇʜᴄʜᴀɴ ᴍᴇɪ ᴏᴋᴀᴛ ᴍᴇ ʀᴇʜ ᴠᴀʀɴᴀ ғᴀᴅᴅᴇɢᴇ ᴛᴇʀᴀ ᴘᴀᴛᴀ ɴʜɪ ᴋᴀʜᴀɴ ᴋᴀʜᴀɴ sᴇ ᴀ ᴊᴀᴀᴛᴇ ʜᴀɪɴ ᴀɴᴅʙʜᴀᴋᴛ ɢᴏʙᴀʀ ʙʜᴀᴋᴛ ᴍᴜᴛ ʙʜᴀᴋᴛ ʟᴀɴᴅ ʙʜᴀᴋᴛ ᴍᴀᴅʀᴀᴄʜᴏᴅ ғᴀᴛᴇ ʜᴜᴇ ᴄᴏɴᴅᴏᴍ ᴋᴇ ᴛᴜ andhabhakta andhere raata ke nateeje teree gaanda phaa.da dege maadarachoda samajhaa are maadarachoda tu eka baapa se paidaa hee nahee ʜᴜᴀ hai agara hotaa to aisa ʀᴇᴘʟʏ ɴʜɪ ᴅᴇᴛᴀ eka daala para 3 kabootara teenon ne diyaa moota katuye kee ammee kee choota ʙᴏʟᴏ jaya shree raama",sarcastic
eesko kese mirchi lage ha ha ha,sarcastic
eesiliye to tum logo ko dogla kaha gya h tum logo ko enraged_face,sarcastic
aura teree aane vaalee saaree naajaayaza nashlon ke sthaana vishesha men mircha lagatee rahegee aura jhaanta sulagate rahegee... face_with_tears_of_joy face_with_tears_of_joy face_with_tears_of_joy,sarcastic
Why are people so brainwashed that a flag means so much to them. We was given flags when we was colonised to keep up separated,non-sarcastic
nhi ye ek din pura desh khajae ge,sarcastic
aallah ho aakbar % jai shri ram..,non-sarcastic
Sudhanshu trivedi fire fire fire fire fire,non-sarcastic
Who eats 1000 dhruv rathee in breakfast face_with_tears_of_joy face_with_tears_of_joy,sarcastic
who are you aji kay problem hai es ran? ko,non-sarcastic
Bhai I wonder yeh kehne ke bad khud sunte h ki nhi kehe kya rhe hein melting_face do they think it's a thing to flex about,sarcastic
5 star do nothing check_mark_button Mountain Dew dar ki mkc check_mark_button moai,sarcastic
Aisa bhi kya bataya nahi jaraha chacha sey clapping_hands face_with_tears_of_joy face_with_tears_of_joy face_with_tears_of_joy face_with_tears_of_joy,sarcastic
ye thoda bhn k l*** h ky,sarcastic
Ikbr in dono ki amne samne debate ho jaye face_with_tears_of_joy,non-sarcastic
face_with_tears_of_joy face_with_tears_of_joy face_with_tears_of_joy face_with_tears_of_joy face_with_tears_of_joy face_with_tears_of_joy,non-sarcastic
Ye Le tere muu pe mera chappal thong_sandal,non-sarcastic
Congress chutiya banaa raha hai face_with_tears_of_joy face_with_tears_of_joy face_with_tears_of_joy face_with_tears_of_joy,sarcastic
Up vale paiso me bik gai hijde face_with_tears_of_joy face_with_tears_of_joy,sarcastic
Jay shree Ram ji orange_heart triangular_flag,non-sarcastic
Dairyam cheyyadam + em cheyyakunda undatam face_with_tears_of_joy face_with_tears_of_joy face_with_tears_of_joy,non-sarcastic
aare niya madarchod randi ke jalmal,non-sarcastic
ram kon ahi he maht ahi ka pahle mahti kar natar bol,non-sarcastic
nirchi kyu lag rhi h tujhe,sarcastic
aaare hi tai nahi rad ahe,non-sarcastic
kya dogle hai mule rabish kumar hota or elvish win karta to ye nhi likte,non-sarcastic
Lalo laula lalo face_with_tears_of_joy face_with_tears_of_joy face_with_tears_of_joy face_with_tears_of_joy face_with_tears_of_joy face_with_tears_of_joy face_with_tears_of_joy face_with_tears_of_joy,non-sarcastic
nilega milega ruko jara khatakhat khatakhat ane main thoda samay lagta hai grinning_squinting_face grinning_squinting_face grinning_squinting_face,sarcastic
Modi h to mumkin h triangular_flag fire check_mark_button,sarcastic
e eact hatao sar . raising_hands raising_hands raising_hands,non-sarcastic
nountain due dar nan ki chut,non-sarcastic
face_with_tears_of_joy face_with_tears_of_joy face_with_tears_of_joy face_with_tears_of_joy face_with_tears_of_joy face_with_tears_of_joy face_with_tears_of_joy face_with_tears_of_joy face_with_tears_of_joy face_with_tears_of_joy rolling_on_the_floor_laughing rolling_on_the_floor_laughing rolling_on_the_floor_laughing rolling_on_the_floor_laughing rolling_on_the_floor_laughing rolling_on_the_floor_laughing,non-sarcastic
Chal gye n bhitre sab aur do Congress ko vote face_with_tears_of_joy face_with_tears_of_joy face_with_tears_of_joy face_with_tears_of_joy,sarcastic
enraged_face enraged_face enraged_face enraged_face enraged_face enraged_face,non-sarcastic
Allah ka baap h ram face_with_tears_of_joy face_with_tears_of_joy,sarcastic
Yha gravity kaha gye loudly_crying_face check_mark_button,non-sarcastic
heat touching cross_mark kidney touching check_mark_button,sarcastic
yaha bhi pelenge waha bhi pelenge...,sarcastic
Remove Waqf and transform everything into govt properties including masjid,sarcastic
Let him know the level he deserves check_mark_button skull #Half knowledge,non-sarcastic
973 missed call from Newton unamused_face,sarcastic
400 par seat ayi tou khtam hoga waqf board,sarcastic
mangalwari amchyakade zaluwali yet nahi suti asate,non-sarcastic
to dekho phir vi bjp badnam he hindu ke liya itna kr ke vi,non-sarcastic
Chunna laga gyaaa rolling_on_the_floor_laughing rolling_on_the_floor_laughing rolling_on_the_floor_laughing rolling_on_the_floor_laughing,non-sarcastic
Lagta hi isko bahut taklif huei bolne do isko iska baap jeet gyea phr bhi rora ine face_with_tears_of_joy face_with_tears_of_joy,sarcastic
Rahul Gandhi cross_mark Modi check_mark_button red_heart red_heart,non-sarcastic
ABOLISH THIS ACT IMMEDIATELY. triangular_flag fire . IF THIS ACT IS SUPPORTED AND PASSED BY MUSLIMS THEN ACCORDING TO ME THIS IS ILLEGAL. THIS IS INEQUAL LAW WHICH SHOULD BE REMOVED AND ALL OTHER COMMUNITIES SHOULD COME TOGETHER AND FIGHT AGAINST IT TOGETHER LEGALLY.,non-sarcastic
lagataa hai bhaaee ne jyaadaa jora se pela diyaa new_moon_face,non-sarcastic
face_with_tears_of_joy face_with_tears_of_joy face_with_tears_of_joy face_with_tears_of_joy mzaaa aa gya,non-sarcastic
eesne toh apni ladki ko bhi nahi chhoda hoga,sarcastic
aapni gad ma apna land gusa la gadu,non-sarcastic
Are tu jare.. face_with_tears_of_joy face_with_tears_of_joy face_with_tears_of_joy face_with_tears_of_joy face_with_tears_of_joy,non-sarcastic
bhai inka to mai bhi support nhi krta aur wese mai bhi madarsa gya hu mere yaha brainwash nhi hota kuch log aise hi gawaar hote hai bhai kya kar skte at the end of the day every Indians are brothers,non-sarcastic
"chhii tumhari,, ma ka,, bs, da,,, enraged_face person_facepalming",non-sarcastic
बीजेपी के वैश्यालयो मे रहने वाली मिडीया face_with_tears_of_joy face_with_tears_of_joy face_with_tears_of_joy,sarcastic
eeske upar kanuni karvayi honi chahie sakht se sakht,non-sarcastic
So many bjp politicians with 6-7 kids face_with_tears_of_joy,non-sarcastic
nountain dew dar ki ma ki choot skull skull skull flexed_biceps flexed_biceps flexed_biceps,non-sarcastic
bhai merko aaye lekin account me dikh rahi rahe rolling_on_the_floor_laughing,non-sarcastic
dar k age jeet h check_mark_button,non-sarcastic
Are baap re. Accha hai ma Hindu hu jai shree Ram Jai Jai shree ram. Proud to be Hindu,non-sarcastic
jai jai guru dev heart_suit heart_suit heart_suit triangular_flag triangular_flag triangular_flag fire fire fire fire,non-sarcastic
pahilee gosta tara hilaa taaee nako boloo randee bola tyaa jitendra aavhaada laa tudavalanya tasa hilaa pana tudavaa .... bolaa jaya shree raama,non-sarcastic
hahaha godi media nahi gadhi medi bolo face_with_tears_of_joy,sarcastic
waqf board ko hata dena chahiye. aand masjido par bhari tax dalna hoga. bahut jald ye hoga. jai shri ram,sarcastic
sardarji behes mat karo chadha do ispe seedha fir wai boldena jo ye bola hai,non-sarcastic
Rider ki maa chodo pahile clapping_hands,sarcastic
nountain due dar ka aga jeet ha cross_mark mountain due dar ki ma ki chut ha check_mark_button,non-sarcastic
teri ma chod deni ti je nai oothe hunda,non-sarcastic
boycott bjp jumla party murdabad murdabad,non-sarcastic
D teri maki face_with_symbols_on_mouth face_with_symbols_on_mouth face_with_symbols_on_mouth face_with_symbols_on_mouth,sarcastic
jay shree ram triangular_flag triangular_flag triangular_flag triangular_flag,non-sarcastic
aaahat hona sapne nein jinda rahegi tumhari nasjid,non-sarcastic
Yed zavi bai aahe hee.... Kattu chi aavlad face_with_tears_of_joy face_with_tears_of_joy face_with_tears_of_joy face_with_tears_of_joy,non-sarcastic
face_with_tears_of_joy face_with_tears_of_joy face_with_tears_of_joy face_with_tears_of_joy face_with_tears_of_joy Rahul Gandhi mahila ko paise do face_with_tears_of_joy face_with_tears_of_joy face_with_tears_of_joy,sarcastic
Physics crying in the corner loudly_crying_face crying_face,non-sarcastic
I love you behan tum log Ke liye main mafi mangta hun jo bhi hai video banaya na kisi itna Maro na mo per bolane alava Shabd nahin Jana chahie tha face_with_tears_of_joy face_with_tears_of_joy,non-sarcastic
to fir mere bhai ye jo owesi jaise logo ko kon badava deta hai inka sunna aur inko follow krna band krdo agr tum bharat ke nuslim hoto...nhi to raste khule huye hai baki desh ke jaha chahe ja skte ho..,sarcastic
Dhruv rathee chutiya hai yar bas bjp ko hi Target bullseye kar ke baida hai face_with_tears_of_joy face_with_tears_of_joy face_with_tears_of_joy face_with_tears_of_joy,sarcastic
Our vote karo kuch nahi milega uneducated people 8.5 k milega pagal ho kya face_with_tears_of_joy,sarcastic
Bangladesh is not even for Indias face_with_tears_of_joy,sarcastic
When there is no content for news...this is what our media does face_with_tears_of_joy,sarcastic
eendia one lady army salute aa bhn tenu,non-sarcastic
Tre bii chud je ge khade kisi p face_with_tears_of_joy face_with_tears_of_joy,non-sarcastic
