Transliterated_Comment,sarcasm_label
face_with_tears_of_joy face_with_tears_of_joy face_with_tears_of_joy face_with_tears_of_joy face_with_tears_of_joy face_with_tears_of_joy,non-sarcastic
aare anpad ourto bjp ki dalalo kha bni ouski sarkar ye godi media h,sarcastic
Jab Yogiji bulldozer nikalenge tab randi rona tum hi karoge face_with_tears_of_joy,sarcastic
etna jaldi bhi kyu kya hai ..aaram se enraged_face ...jinda wad ..,sarcastic
"Koi hai ,please can someone explain it for me thinking_face I didn't understand it person_pouting",non-sarcastic
oop wale to hijde nikle mc,sarcastic
Aur do modi ko dhokha mil gya n khata khat face_with_tears_of_joy,sarcastic
Bilkul vi nahi face_with_rolling_eyes yea to nayensafi hai,sarcastic
aab me kuch bolunga to vivad ho jayega,non-sarcastic
nahi ap ki koi galti nahi hai ham pagal hai,non-sarcastic
fire fire fire fire fire fire fire fire fire fire fire fire,non-sarcastic
Rahul gandi gorib lok ko gandi marega grinning_face_with_smiling_eyes grinning_face_with_smiling_eyes,sarcastic
"aall bikers should be ban in eendia , sare bikers ki ee'd report karo please, phir ye bike stunt krna apne ap band kr denge inki wajah dusre logo ko nuksan pohochta h",non-sarcastic
Are Bhai wo Hindu hi hain bas BJP Wale Hindu nhi Hain face_with_tears_of_joy,sarcastic
Tum news vale in logo ke pass he ja sakte ho rolling_on_the_floor_laughing rolling_on_the_floor_laughing,sarcastic
la hi lallllla ... teri. gand m lola,sarcastic
Congress supporter clown_face BJP supporter moai,non-sarcastic
eesee ko kahaa jaataa hai bharavaa giree galata kaama kejareevaala karen agara jela jaae to ba.davaa giree karane aise hee loga aate hain,non-sarcastic
Yaha muje Congress ko support krne wale dikhayi nhi de rahe hai face_with_tears_of_joy,non-sarcastic
sirf tu katwe kar sakte ho lawade,sarcastic
sudanshu ji jab subah uth te hai mootne ko 3-4 dhruv rathi aise hi gir jate hai skull skull skull,non-sarcastic
Mulle cross_mark bachhe paida karne ki factory check_mark_button,sarcastic
Ram balwan cross_mark ravan se ldhne v ni skta tha face_with_tears_of_joy check_mark_button,non-sarcastic
aa sab tere jija hai jo sasurar me the,non-sarcastic
Jhut felao aur jhut felao kon hi Google chlana janta hai didi face_with_tears_of_joy,sarcastic
ne nuslim hu lekin ye post kana galat bat he kisi bhi dharam ke bareme galat post na karna chaiye ye bat se me sahamat hu,non-sarcastic
har ek jagah jitne se thodi hota hai sabhi ji jawab jite rahul gandhi to fir maja tha,sarcastic
German shepherd do not entry in Indian problem,non-sarcastic
aallah hu aakbar cross_mark hila lo ek bar check_mark_button,non-sarcastic
face_with_tears_of_joy bro itna sach bol diya hai,non-sarcastic
सहज़ गेलो सङ्कला गांडित हातभर अङ्कला face_with_tears_of_joy face_with_tears_of_joy face_with_tears_of_joy,non-sarcastic
Khtakhat khtakhat chuna bhi lga diya congress ne face_with_tears_of_joy face_with_tears_of_joy face_with_tears_of_joy face_with_tears_of_joy,sarcastic
Kida Bhi Tere Me Tha Na face_with_tears_of_joy,non-sarcastic
toh apne dabur se lawra naukari mnglo khudke liye,sarcastic
isakee maan aura baapa kee galatee hai ye fire fire,non-sarcastic
jo hindu om wahi sapot kre bhai log,non-sarcastic
Owaisi tu converted hai agar ye tu puri zindgi bolega to terre baap dada ne jay shree ram bolna nahi sikhaya face_with_tears_of_joy,non-sarcastic
Call an ambulance but not for me,sarcastic
tu aicha bosda . . nako manu tu ghal tuji tikde bosdicha . . vote mang clapping_hands,non-sarcastic
kyu ki wo abhi ma chudwa rha hai moai face_with_tears_of_joy,sarcastic
"sudheera bhaaee saahaba aapa aba to maana lo kee 600/0 janataa modee ko naheen chaahatee,,,, maana leejie,,,15 laakha ke jhootha se to kama hee hai,,, aapa maana jaaen enraged_face enraged_face enraged_face",sarcastic
jarmana shephara tujhe jo rotee kaa tuka.daa daala rahaa he bhaajapaa paartee aura hinduo kaa virodha karane kaa. tujha se bahuta galata kaama karaa rahe he.,non-sarcastic
bhai or to sab thik he pr yha to tumhari hi galti thi tempu vale ka nuksan ho gya garib ke sath esa mat kro bhai vo unke kamai karne ka sadhan he bhai crying_face,non-sarcastic
shee hyaa sadakyaa gaandeelaa kona jhavala.. jaama vaasa yeta asela..,sarcastic
raised_fist raised_fist angry_face_with_horns flexed_biceps flexed_biceps flexed_biceps mechanical_arm India kitchen_knife kitchen_knife kitchen_knife kitchen_knife kitchen_knife cross_mark,sarcastic
face_with_open_mouth narak ki yatra tay h iski.....jahil mahila,non-sarcastic
"2 Muslim Country , 1)Pakistan, 2)Khalistan yawning_face yawning_face yawning_face yawning_face",sarcastic
Druv rathi biggest scammer clown_face enraged_face face_with_symbols_on_mouth face_with_symbols_on_mouth,non-sarcastic
German shepherd ki skull jal gyi Puri face_with_tears_of_joy,non-sarcastic
jai shree ram triangular_flag triangular_flag triangular_flag triangular_flag triangular_flag triangular_flag triangular_flag triangular_flag triangular_flag triangular_flag triangular_flag triangular_flag triangular_flag triangular_flag triangular_flag triangular_flag triangular_flag triangular_flag triangular_flag triangular_flag triangular_flag triangular_flag triangular_flag triangular_flag triangular_flag triangular_flag triangular_flag triangular_flag triangular_flag triangular_flag triangular_flag triangular_flag triangular_flag triangular_flag triangular_flag triangular_flag triangular_flag triangular_flag triangular_flag triangular_flag triangular_flag triangular_flag triangular_flag triangular_flag triangular_flag triangular_flag triangular_flag triangular_flag triangular_flag triangular_flag triangular_flag triangular_flag triangular_flag triangular_flag triangular_flag triangular_flag triangular_flag,non-sarcastic
"Took It Seriously, Sad for Him",non-sarcastic
chutiya rider hai bahan chod aapne bap se bhi aise bat karta hai ghar mein,non-sarcastic
Desh ki Janta khule vichar ki hai isliye toh tumara aur unke Papa ko jitaya face_with_peeking_eye face_with_peeking_eye rolling_on_the_floor_laughing,sarcastic
Kidney me heart attack aa gaya ye dekh ke crying_face slightly_smiling_face,non-sarcastic
Sale chuna laga gaya face_with_tears_of_joy face_with_tears_of_joy face_with_tears_of_joy face_with_tears_of_joy face_with_tears_of_joy,sarcastic
ne up se hu aura maine aura mere parivaara ne khula kara bhaajapaa ko vota diyaa hai men garva se kahataa hoon ki main hindoo hoon lekina aphasosa kee dogalo ke beecha men janma milaa,non-sarcastic
sushmaa raanddeechee tujhyaa bhokaata jhaandoo baama laaoona ghaatalaa naa maga kalela,sarcastic
face_with_symbols_on_mouth face_with_symbols_on_mouth face_with_symbols_on_mouth enraged_face enraged_face enraged_face,non-sarcastic
Fhir bhi vote pappu ko hi denge ye bevkuf Hindus crying_face,sarcastic
and yes iam a proud muslim green_heart we respect your religion ... You better not post such provocative and manipulative reels just for the sake of trolling a particular religion that's my kind request ... We could do the same with other religions too but we do respect your beliefs cuz we are Indians first then muslims India,non-sarcastic
bhai mere sabhi pariwar me bjp ki triangular_flag hi vot hai kya kre bha crying_face,non-sarcastic
Jai shri ram fire red_heart raising_hands,non-sarcastic
क्या मै ही हू जिसे ये फोकट मांगने वाले सब specific R***gion के दिख रहे है??? face_with_rolling_eyes face_with_rolling_eyes face_with_rolling_eyes,non-sarcastic
Garv se bolo hum hindu hain face_with_tears_of_joy triangular_flag,sarcastic
"maajhan mhananan hecha़ aahe aataa vela aalee, hyaanchee saangada baandhaayalaa ghene sarva ekatra bhara chaukaata jeevanta jaalane bhadavyaannaa",sarcastic
vedee baaee kaaya bolatee kalate kaa,non-sarcastic
face_with_tears_of_joy face_with_tears_of_joy face_with_tears_of_joy face_with_tears_of_joy face_with_tears_of_joy face_with_tears_of_joy line mein Khade raho,sarcastic
One five star do nothing + mountaim dew dar ki ma ki chut,non-sarcastic
Ka fir se kaat gaya rolling_on_the_floor_laughing rolling_on_the_floor_laughing grinning_face_with_sweat grinning_face_with_sweat,non-sarcastic
yaa baaeelaa jaraa ekadaa jityaa saarakhan haanalan paahije,non-sarcastic
proud to be sanatani triangular_flag ye log nr kiun nhi jate jab inki sich hi nr chuki hai,non-sarcastic
Kabrr pe paiir latke hai aur baat krte hai world record todne kii mkl saale face_with_tears_of_joy face_with_tears_of_joy,sarcastic
Bhai woh toh iss bareme bol Chuka hai,non-sarcastic
meraa kendra sarakaara se anurodha hai ki kendra sarakaara ko phree 5 kilo anaaja vaalee skeema banda kara denaa chaahie folded_hands_medium_skin_tone folded_hands_medium_skin_tone folded_hands_medium_skin_tone folded_hands_medium_skin_tone folded_hands_medium_skin_tone folded_hands_medium_skin_tone folded_hands_medium_skin_tone kyaa aapa isa se sahamata hain to sheyara karen folded_hands_medium_skin_tone folded_hands_medium_skin_tone folded_hands_medium_skin_tone folded_hands_medium_skin_tone folded_hands_medium_skin_tone folded_hands_medium_skin_tone folded_hands_medium_skin_tone,non-sarcastic
My house bricks touching performance loudly_crying_face,non-sarcastic
Jay shree ram triangular_flag triangular_flag heart_hands_light_skin_tone,non-sarcastic
tujay gandit kami kida val val nohata karat tujay var pan action ghetali pahijay..,non-sarcastic
tum log ko saram nhi kya,non-sarcastic
I like bjp red_heart red_heart triangular_flag हिंदू हिजड़ा ही रहेगा हमेशा check_mark_button,sarcastic
cross_mark check_mark_button check_mark_button cross_mark rolling_on_the_floor_laughing rolling_on_the_floor_laughing,non-sarcastic
clapping_hands clapping_hands clapping_hands raising_hands raising_hands raising_hands face_with_tears_of_joy face_with_tears_of_joy face_with_tears_of_joy,non-sarcastic
do nothing dar ki na ki ch,non-sarcastic
bhai ye tum india se baha hi kar sake ho yaha hote to pata chalta,sarcastic
Hat bebkuf jai shree ram jay BJP red_heart fire fire fire,sarcastic
use condom kaaba Sev earth globe_showing_Europe-Africa . Jay shree Ram triangular_flag triangular_flag triangular_flag triangular_flag,non-sarcastic
Jai shree ram jai bajrangbali smiling_face_with_hearts smiling_face_with_hearts smiling_face_with_hearts,non-sarcastic
rolling_on_the_floor_laughing rolling_on_the_floor_laughing rolling_on_the_floor_laughing rolling_on_the_floor_laughing crying_face face_with_tears_of_joy face_with_tears_of_joy,non-sarcastic
kya be ab bol ye nahi dikhega tujhe ap ka pilla,non-sarcastic
enraged_face enraged_face enraged_face enraged_face enraged_face enraged_face enraged_face enraged_face enraged_face enraged_face enraged_face,non-sarcastic
socho agar yahi ...kam ladki ke hoti ...to admi chor deta aur ladki sorry bol k kat leti,non-sarcastic
aare bhai koi iske mu*** me la***d dalo,sarcastic
face_with_tears_of_joy face_with_tears_of_joy chuslam face_with_tears_of_joy face_with_tears_of_joy face_with_tears_of_joy,non-sarcastic
face_with_tears_of_joy moai z face_with_tears_of_joy face_with_tears_of_joy face_with_tears_of_joy face_with_tears_of_joy face_with_tears_of_joy face_with_tears_of_joy moai check_mark_button moai moai moai moai,non-sarcastic
to nikalo desh ke bahr pakistan jaa hmara desh hmare ram bhgwan ka he hamare desh kha rha he or tu bol rha he bdhe,non-sarcastic
chu ke sirf dikha dena 72 hoor dikha dange,sarcastic
Bike Wale ki galti hai face_with_tears_of_joy,sarcastic
ham hindu hai up 16 jai shree ram triangular_flag triangular_flag triangular_flag triangular_flag,non-sarcastic
Jali na jali hnnnnnn face_with_tears_of_joy face_with_tears_of_joy face_with_tears_of_joy face_with_tears_of_joy face_with_tears_of_joy face_with_tears_of_joy,non-sarcastic
ye bhi bolio ki pehle tumhare qaum ke gadhe ghatiya gira hua babr ne mandir todke masjid bnaya isliye to hinduo ne apni jgha wapas leli bss boldio,non-sarcastic
Lucknow ki parwris he aisi hai unko yahi sikhaya jata hai pagal aurat hai ye ye wonaurat hai jo nang (नग्न) hoti hai jine na ijjat ki na bejati ki pdi hoti or dhmki deti hai hum Lucknow se hai face_with_tears_of_joy face_with_tears_of_joy face_with_tears_of_joy apni aukat dikhani he jo hoti hai,sarcastic
