Transliterated_Comment,sarcasm_label
sarakaara banaane abhee pahuncha gayaa ko paisaa lene chalo paagala hai,sarcastic
gali de kr bhi bar bar gali dene wale button check_mark_button,sarcastic
jo log u.p walo ko aisa kah rhe hai wo ake dekhe aur bole fir pata chal jayega k u.p wale kya yaha insta pe bhonkne se kya hoga ... face_with_open_mouth,sarcastic
Pappu ne sbko pappu bna diya check_mark_button face_with_tears_of_joy face_with_tears_of_joy,sarcastic
Or jitao congress ko face_with_tears_of_joy cut gya chutiya face_with_tears_of_joy,sarcastic
Serial wala acting ab reels me kab se aane laga bhai rolling_on_the_floor_laughing rolling_on_the_floor_laughing,non-sarcastic
kevala vaha baaten karate hain kaama kucha naheen,non-sarcastic
galti us car wale ki hai ki usne isse udayaa nii face_with_tears_of_joy face_with_tears_of_joy,sarcastic
eetna time nahi lagta gravity attract very fast,non-sarcastic
bol dhruv adhi bat leke ata hai,sarcastic
are hamaare shiva jee to bhole naatha hai| jo cha.daao saba sveekaara karate| aba ye mahilaa kee shakala aura akala hee phate condom kee taraha to bahee cha.dhaa rahee kyukee isake baapa ne ise paidaa karate taaima ye khuda cha.daayaa hotaa to ye dina unako na dekhano ko milataa| inake jaisee aulaade na ho isalie hee sarakaara condom kaa add de rahee relieved_face,sarcastic
nountain dew dar ki ma ki chut check_mark_button,sarcastic
बरोबर आहे smiling_face_with_heart-eyes smiling_face_with_heart-eyes smiling_face_with_heart-eyes smiling_face_with_heart-eyes smiling_face_with_heart-eyes smiling_face_with_heart-eyes smiling_face_with_heart-eyes smiling_face_with_heart-eyes,non-sarcastic
"phir bhi walo ne bjp ko sabse jyada seat di h ye mat bhoolo, wo bat alag h ki 60℅ dogle bhi h",sarcastic
main eka muslima allaaha hoo akabara,non-sarcastic
yaa ashyaa haraamakhoraannaa nivadanukeechyaa velesa janatene nakkee vaaleeta taakaayalaa havan kaarana he sudharanaaryaatale naaheeta jyaa bhaarataata raahataata tetheela devadaivataanbaddala ashe ghaanerade shabda bolataayeta.... matadaara raajyaa naa maajhee vinnatee aahe ashyaa vyakteennaa tyaanchee laayakeenusaara jaagaa daakhavaayalaa havee....... folded_hands_light_skin_tone folded_hands_light_skin_tone folded_hands_light_skin_tone triangular_flag triangular_flag folded_hands_light_skin_tone folded_hands_light_skin_tone folded_hands_light_skin_tone,sarcastic
hichaa aaeelaa resa cha ghodaa laavaa saapadela tithan,non-sarcastic
Moye Moye ho gaye ho aap log rolling_on_the_floor_laughing,non-sarcastic
Backbenchers after learning the all concepts of Newton face_with_tears_of_joy,non-sarcastic
Jay shree ram clapping_hands fire raising_hands red_heart,non-sarcastic
यूपी वाले हिजड़े है हिजड़े face_with_symbols_on_mouth face_with_symbols_on_mouth face_with_symbols_on_mouth,non-sarcastic
India India India enraged_face enraged_face enraged_face,non-sarcastic
Tu chhinal ahe mhnun chhinal vanich bolnar,non-sarcastic
aise rila banaa banaakara kaba taka daaloge utho aura aavaaja uthaao inake khilaapha sirpha soshala meediyaa para laaika aura phaॉlo ke lie yaha saba mata karo isakaa sahee upayoga karo saba unako kabhee tikata na mile aisaa kaama karo,sarcastic
sahi kaha sanatan dharm ke jai triangular_flag triangular_flag triangular_flag,non-sarcastic
ai hindoo naee katalee kee olaada hai enraged_face,non-sarcastic
अयोध्या cross_mark cross_mark cross_mark सीतामढ़ी check_mark_button check_mark_button check_mark_button,sarcastic
If this is that rider's official ig then shame on you it's your fault and then you have decency to argue. It's because of you idiot chapri riders the reputation of other riders who well and truly knows how to ride safe take a hit as well.,non-sarcastic
Ek bar dhruv ko samne ana chahiye rolling_on_the_floor_laughing face to face debate hona chahiye,non-sarcastic
jaba teree maa.n ko teraa baapa pela rahaa hai to too nee pela sakataa hai kyaa teree maa.n ko face_with_tears_of_joy,sarcastic
aare jakar kam dekho sahi atankwadi ko to pakad nahin pate,non-sarcastic
jay shri ram triangular_flag triangular_flag triangular_flag,non-sarcastic
aba to bola do up baalo tuma hija.de ho,sarcastic
Abe Tu chal abe Tu chal chal re rolling_on_the_floor_laughing rolling_on_the_floor_laughing,non-sarcastic
13 baje bhi aiyega to nhi milega abb sudhro re mahilao berna katam kroge yogiadityanath jee ne face_with_tears_of_joy face_with_tears_of_joy face_with_tears_of_joy face_with_tears_of_joy face_with_tears_of_joy face_with_tears_of_joy,sarcastic
bc glti neri thi jo maine puri video dekhi,non-sarcastic
तेरे को तो बहुत मजा आता होगा face_with_tears_of_joy face_with_tears_of_joy,non-sarcastic
ekandareeta taaee mhanuna taaee shabdaachaa apamaana nakaa karoo,non-sarcastic
He said seating cm rolling_on_the_floor_laughing but blind devotees can't even hear also rolling_on_the_floor_laughing,sarcastic
ye bhosdeka h or gali bale lick kare,sarcastic
aaja dekha liyaa vota ke chota men desha kaa kyaa haala hai crying_face crying_face,non-sarcastic
eesa ko bagaira kodanma ke honaa,non-sarcastic
aapril fool banaya. oonko bada maja aya,non-sarcastic
kabje ka to pata nahi pr bhiek jarur mangoge skull,non-sarcastic
Is ki bhi gand jal gayi fire crying_face,non-sarcastic
Are he bhikar chodko he kam hota hai mufat ka Lena face_with_tears_of_joy congress aya nahi or inko paise hona face_with_tears_of_joy,sarcastic
ye sali ....jis din bhi dikh gai na samne......uska muhhh kala nahi kiyaa to mera nam bdl dena.........jaha bhi jati hogi mrvane waha condom leke hi ghumti hogi......beshhrrrmm kahi ki,sarcastic
een sab ki ma chod dunga mai agar mai rehta toooo,sarcastic
sushma gav zhavdi like button right_arrow,non-sarcastic
aapako pataa hai mirchee kahaa.n lagatee hai,non-sarcastic
"We can now have a ""BHARAT PROPERTY ACT"" fire fire fire fire",sarcastic
nala hiech sant nahi nakki kaavaryaa kote hich hich foda etaka zavaun zavaun mokala karava srwach hindfuni. ki khi nav shishamaa pan hi ranad ahe heil lonache lavadecha paahijeta,non-sarcastic
krishna ki abhari hoon ki hindu ghar me humko janam dia triangular_flag,non-sarcastic
jay shri ram jay shri ram jay shri ram yogi ji apki bhi jay ho bhagwan shri ram ke sath mein apke piche jay ho ki red_heart red_heart clapping_hands,non-sarcastic
aare jitne se milega na check_mark_button,sarcastic
tihaadee kee bahuta buree jala rahee hai face_with_tears_of_joy,non-sarcastic
"sir, burnol ke liye paise hai? fund raise toh nhi karna padega?",sarcastic
slightly_smiling_face thumbs_up jaaoode bhaavaa chukee tujhee naahee tyaa raatree tujhaa baapa gapa jhopalaa asataa tara haa divasa nasataa aalaa crying_face,non-sarcastic
krrishnaa bhagavaana ko arjuna ko samajhaane me kitanaa taaima lagaa| lekina aaja ke hinduo ko samajhaane kai karo.do saala laga jaaege to bhee naahee samajha aaegaa,sarcastic
गोल माल है भाई सब गोल माल है face_with_tears_of_joy face_with_tears_of_joy face_with_tears_of_joy,non-sarcastic
Literally the maths teacher reaching school skull,sarcastic
rolling_on_the_floor_laughing rolling_on_the_floor_laughing rolling_on_the_floor_laughing rolling_on_the_floor_laughing rolling_on_the_floor_laughing rolling_on_the_floor_laughing rolling_on_the_floor_laughing,non-sarcastic
Delhi waale hai fire fire fire,non-sarcastic
dunaliyaa kee pahalee mahilaa itanaa maaga bharee hai grinning_face_with_sweat,non-sarcastic
maa ki chuttt Teri face_with_symbols_on_mouth face_with_symbols_on_mouth face_with_symbols_on_mouth face_with_symbols_on_mouth,non-sarcastic
Hindu hone pe hame grv hai..... Hamare devtawonka apman karnewalonka nash karna bhi ham hindu jante hai smiling_face_with_heart-eyes,non-sarcastic
teri ma ki chut sale hizade nalle ko aulad enraged_face,non-sarcastic
Ye anchor to chutiya ka leader lagta hai rolling_on_the_floor_laughing rolling_on_the_floor_laughing rolling_on_the_floor_laughing,sarcastic
niklo ab yaha se phta phat face_with_tears_of_joy face_with_tears_of_joy face_with_tears_of_joy face_with_tears_of_joy,non-sarcastic
dhruv muh...me lele sudhanshu ji ka,sarcastic
Acting cross_mark ultra pro max over acting check_mark_button,sarcastic
Bol ke mera loda lega kya face_with_tears_of_joy,sarcastic
"In the case of Thiruchendurai, Tamil Nadu, the Waqf Board's claim over the entire village including temple land appears to be based on historical records and a survey conducted in 1954 which assigned the land to the Waqf Board. The Waqf Board can assert control or ownership over properties that are legally recognized as waqf, either through historical records, registration, or other documentation that legally identifies the property as waqf. The key issue in this scenario is whether the properties were indeed legitimately registered as waqf properties and whether the necessary legal processes were followed. It's important to note that waqf properties, once legally established, are meant to be used for charitable or religious purposes in perpetuity according to Islamic law, and the Waqf Board is responsible for their management. However, if there are disputes or if local residents have evidence (such as title deeds) proving their ownership, these claims can be challenged legally. The residents of the village in question appear to be contesting the Waqf Board's claims based on their possession of title deeds and other documents. This has led to a hold on the Waqf Board's claims pending further investigation and legal review.",non-sarcastic
Nice buro yes I am Hussain khan is me happy owesi brothers and cold and my friend is all is well with your video,non-sarcastic
Kashala tuzi aai ghatli mg lavdya face_with_tears_of_joy face_with_tears_of_joy,non-sarcastic
Bro was the engineer to construct the bridge check_mark_button,non-sarcastic
fir bolte ha ki rojgar nhi mil rha.,sarcastic
Nehru aur gandhi ke karam.. bhugat rahe hain aaj hum smiling_face_with_open_hands,sarcastic
Proud to be Hindu triangular_flag triangular_flag,non-sarcastic
dhruv nhi bhai dhruv bolke santan nam ko apman na hone de dallah bolliye,non-sarcastic
aagar ye hatana he to apki bar 400 par kro,sarcastic
monkey monkey monkey monkey monkey monkey monkey aavadasaa aahe hee,non-sarcastic
waft ko duniya se hata denge,non-sarcastic
Star + dew = noice view moai,non-sarcastic
Sitting CHIEF MINISTER bsdk kam sunai deta hai rolling_on_the_floor_laughing,sarcastic
Jai shree Ram red_heart red_heart red_heart red_heart red_heart,non-sarcastic
face_with_tears_of_joy face_with_tears_of_joy face_with_tears_of_joy face_with_tears_of_joy face_with_tears_of_joy face_with_tears_of_joy,non-sarcastic
"U deserve this, atleast u have use proper words in your cheap rap.U jumped in this matter to become famous",non-sarcastic
फुकट का चाहिये सालो को सब... ह****** झाले... हराम का खाते... इन लोगो के वजे से ना लोकसंख्या बढ रही है... अब बैठो खटाखट खटाखट करते face_with_tears_of_joy face_with_tears_of_joy face_with_tears_of_joy face_with_tears_of_joy face_with_tears_of_joy,sarcastic
Jay shree ram ji red_heart triangular_flag hundred_points folded_hands,non-sarcastic
tujhee laayakee kaaya too bolate kaaya,non-sarcastic
Jay Shree Ram red_heart red_heart red_heart,non-sarcastic
Filmo se 400 vot aage face_with_tears_of_joy face_with_tears_of_joy,non-sarcastic
ek ek ki ma chodunga in khalistani atankbadi ki enraged_face enraged_face randy ki paidaish,sarcastic
khalistani enraged_face ... aaager yh eendia mein hota to in khalistaniyon ko inki aukat dikha dete eendia,sarcastic
jay hind jay bharat eendia eendia eendia,non-sarcastic
Rahul Gandhi Moy moy ho kar diya beaming_face_with_smiling_eyes clapping_hands,non-sarcastic
Is bhen ki laudi ko mardo red_heart fire fire,sarcastic
nountain dew cross_mark desi daru check_mark_button,non-sarcastic
Load van driver must be worshipped by two wheeler rider because the load van driver saved the life of two wheelers rideer endangering his own life.,sarcastic
